{
  "spec": "PP-SPEC-080",
  "profile_id": "6a5ef18e10d3379e306d7afc8a03e1b03e7bf45680161ceb67b802b53345a844",
  "name": "Cyber Insurance Underwriting",
  "version": "2.0.0",
  "consumer": {
    "id": "nebulonium:seed-profiles",
    "public_key": "unspecified"
  },
  "purpose": "underwriting",
  "applies_to": [
    "web-application",
    "endpoint-host",
    "identity-access",
    "cloud-workload",
    "agentic-ai-controls"
  ],
  "all_classes_required": false,
  "mine_plan": {
    "per_profile": {
      "min_bounded_runs": 1,
      "colors_required": [
        "white",
        "gray",
        "red",
        "black",
        "gold"
      ],
      "composition": "cmp-underwriting",
      "composition_min_version": "1"
    },
    "jcp_required": "when_agent_holds_credentials",
    "production_stream_min_days": 30
  },
  "environment_classes": {
    "in_situ": [
      "production",
      "pre-production"
    ],
    "independent_lab": {
      "accepted": true,
      "reference_environments": [
        "recognized"
      ]
    },
    "purpose_overrides": {
      "renewal": [
        "production",
        "pre-production",
        "qa",
        "dev"
      ]
    }
  },
  "regulatory_regime": "any",
  "conformance_level": "registered",
  "max_record_age_days": 180,
  "series": {
    "required_for": [
      "renewal"
    ],
    "min_entries": 2,
    "max_gap_days": 120,
    "accept_stale": false
  },
  "claim_findings": {
    "default": "flag",
    "rules": [
      {
        "when": "purpose == renewal and technique in holder.declared_threat_model and finding.remediated == false",
        "action": "reject"
      }
    ]
  },
  "absence_limits": {
    "blind_share_max": 0.1,
    "void_share_max": 0.1
  },
  "disclosure": {
    "accepted": [
      "public",
      "holder_only"
    ],
    "holder_only_requires_delegation": true
  },
  "registries": "any_cross_anchored",
  "self_provided": "accepted_with_external_witness",
  "funding_tiers": [
    "implementor_funded",
    "pesa_governed"
  ],
  "extensions_accepted": [],
  "retroactive": false,
  "supersedes": "a00c9ae782872210cbb4ff74debb6b724c0cb6331ead115f561461cbed2ca639",
  "notes": "Seed profile, version 2.0, supersedes 1.0. Adds the reproof requirement (PP-SPEC-080 4.5, PP-SPEC-081). No thresholds by design: the profile admits proof to a pricing model, it is not the model.",
  "drift": {
    "accept_fragmented": false,
    "max_corpus_age_days": 90,
    "rates_across_segments": false,
    "reject_if_undeclared": [
      "control",
      "corpus",
      "harness",
      "pigtail"
    ]
  },
  "authorship_disclosure": {
    "required": true,
    "human_review_required": true,
    "profile_disclosure": "https://github.com/proofprotocol/PP-SPEC-080-ACCEPTANCE-PROFILES/blob/main/ai_disclosure.json"
  },
  "reproof": {
    "min_status": "reproven",
    "scope": "instance",
    "min_independent_checks": 1,
    "max_splitting_limits": {
      "stopped_rate": 0.05,
      "false_block_rate": 0.05
    },
    "on_divergent": "flag",
    "on_disputed": "reject",
    "on_not_upheld": "reject",
    "on_checked_insufficient": "flag",
    "min_umpire_pool": 3,
    "max_comparison_age_days": 180,
    "by_purpose": {
      "renewal": {
        "scope": "either"
      }
    }
  }
}
